{
  "schemaVersion": 1,
  "verifiedAt": "2026-09-02T03:41:11.8356772Z",
  "evaluator": {
    "provider": "dashscope",
    "model": "qwen-vl-max",
    "protocol": "openai"
  },
  "prompts": {
    "blind": {
      "promptId": "blind-visual-v1",
      "canonicalSha256": "51a96b858aab24b1aecd1d2574067337b5e7359fdeb724234b4c6a0522fe7b64"
    },
    "target": {
      "promptId": "target-verification-v6",
      "canonicalSha256": "5b0f1bcfceff8dfd85590c37d3ba7aeb40cb48e424ef77e46262fe5d5beacbe2"
    }
  },
  "normalizer": {
    "id": "evaluator-json-normalizer-v2",
    "acceptedPresentations": ["raw-json", "single-json-code-fence"],
    "contractRequired": true,
    "enforcedReferences": [
      "blind-observation-evidence-ids",
      "target-criterion-ids",
      "target-image-evidence-ids",
      "target-deterministic-evidence-ids",
      "target-hard-failure-rules",
      "target-hard-failures-derived-from-critical-fails",
      "target-core-status-derived-from-critical-statuses"
    ]
  },
  "independentInputs": true,
  "executionAgentExposed": false,
  "status": "verified",
  "smoke": {
    "cliVersion": "1.18.1",
    "skillVersion": "1.18.1",
    "inputHashMode": "canonical-bundle-v1",
    "imageSha256": "3d11d2350aaad404288a105575e7a80004d47dddd9877380ea1d19620c621e0c",
    "targetContractSha256": "8e4ac01befe7b6210edc4addc7c36aea3860406488ecdac73a1e14eaee544679",
    "blindInputSha256": "bfe859283bbfc856d347b701050afba788b7182d38c3c5a8cd55682acec7d3aa",
    "targetInputSha256": "2fde0f28644f37b5711566f24a878a94ab97d66f0f01d40484b139e0704d9ee5",
    "blindResultSha256": "043bd75f78ed35192dc3b2dd0502a4e643a9b381751b2916b81dbd68dfe01bc0",
    "targetResultSha256": "e62e5ab083f4e586833b97b6ed381ea0e54d77a73e89dd3fc8df9cccb4c3ccbd",
    "blindAttempts": 1,
    "targetAttempts": 6,
    "blindTransportFailures": 0,
    "targetContractRejections": 5,
    "blindSemanticOk": true,
    "targetSemanticOk": true
  }
}
